{
  "schema_version": "1.0",
  "updated_at": "2026-10-18",
  "description": "Maintained overlay for exact reviewed-source artefact digests and post-production human assurance. Empty entries are not inferred: absence of an entry or assurance statement never implies human review or verification.",
  "authorship_provenance": {
    "content_origin": "ai-authored",
    "generation_mode": "semi-autonomous",
    "human_role": "contract-approver",
    "human_authorship": false,
    "human_review_status": "not-reviewed",
    "human_verification_status": "not-verified"
  },
  "source_reviews": [
    {
      "vigil_source_id": "EXT-8FEA9674D97A",
      "external_source_id": "AAM-SDOS-RUNTIME-GOVERNANCE",
      "source_version": "1.10",
      "source_metadata_fingerprint": "0bcd14357693a05490db8d87752677fedd89a4ee2b14ddbb9cd6fec7df4e5047",
      "reviewed_source_digest": {
        "algorithm": "sha256",
        "digest": "547bfa9615f137429871951e2beb8de8f306ed8ae4995e6ef95dfcfbcc23c52b",
        "recorded_at": "2026-08-28",
        "artefact_role": "reviewed-primary-source",
        "access_basis": "public-primary",
        "evidence_ref": "https://aamcyber.com/sdos/reference/v1/"
      },
      "assurance_provenance": []
    },
    {
      "vigil_source_id": "EXT-13FB945E8A06",
      "external_source_id": "CYCLONEDX-SPEC",
      "source_version": "1.7",
      "source_metadata_fingerprint": "4bbf3797bfe26e75f526099b314cefef4a6b83be23ee37d1ae187d08bbd75bd1",
      "reviewed_source_digest": {
        "algorithm": "sha256",
        "digest": "df472ef4aaf593904c479293723a1a5c191d6672715c93b3c0b5c318f3914221",
        "recorded_at": "2026-08-28",
        "artefact_role": "reviewed-primary-source",
        "access_basis": "public-primary",
        "evidence_ref": "https://github.com/CycloneDX/specification/blob/4b3f59453366e27c8073fd24e98bf21ef8892c8e/schema/bom-1.7.schema.json"
      },
      "assurance_provenance": []
    },
    {
      "vigil_source_id": "EXT-31AD0314218F",
      "external_source_id": "IEEE-7000",
      "source_version": "2021",
      "source_metadata_fingerprint": "95bc320d2635855ba0e366820a431f2d76e1f44a15664b82ee16b9ecc4139851",
      "reviewed_source_digest": {
        "algorithm": "sha256",
        "digest": "559bdf6648f0d5f70529fd71848f068c92718ca9aa577a7de7abd8dc060b8ef6",
        "recorded_at": "2026-09-03",
        "artefact_role": "reviewed-primary-source",
        "access_basis": "licensed-primary",
        "evidence_ref": "https://standards.ieee.org/ieee/7000/6781/"
      },
      "assurance_provenance": []
    },
    {
      "vigil_source_id": "EXT-564A4CAA4F00",
      "external_source_id": "IEEE-7009",
      "source_version": "2024",
      "source_metadata_fingerprint": "d7944ab6f22e4bd1b825703219e38c84206f5c3bfb6ad28ad25d533f010e936d",
      "reviewed_source_digest": {
        "algorithm": "sha256",
        "digest": "9fb640fd57202fcc1c90aec0b6b767bf5c4621bfdefa7911c5e102425a83b133",
        "recorded_at": "2026-09-03",
        "artefact_role": "reviewed-primary-source",
        "access_basis": "licensed-primary",
        "evidence_ref": "https://standards.ieee.org/ieee/7009/7096/"
      },
      "assurance_provenance": []
    },
    {
      "vigil_source_id": "EXT-17722772CDFD",
      "external_source_id": "IEEE-7014.1",
      "source_version": "2026",
      "source_metadata_fingerprint": "3722157f3ab50c56ce4ac6c10b8c7af8c626e1bc40119f525b2418c8269d209a",
      "reviewed_source_digest": {
        "algorithm": "sha256",
        "digest": "abbc2c95d5fa41fd5aeb9d0326d2b2c8f57e34c1245cba3f19c048c40efa209a",
        "recorded_at": "2026-09-03",
        "artefact_role": "reviewed-primary-source",
        "access_basis": "licensed-primary",
        "evidence_ref": "https://standards.ieee.org/ieee/7014.1/11609/"
      },
      "assurance_provenance": []
    },
    {
      "vigil_source_id": "EXT-3CCBC407EAC8",
      "external_source_id": "IMDA-AGENTIC-AI-MGF",
      "source_version": "2026-05",
      "source_metadata_fingerprint": "fadb6f8c69037ca63d3e5c5e180dad3757560ea9e46b156666799be6776a592e",
      "reviewed_source_digest": {
        "algorithm": "sha256",
        "digest": "2636e19ff1c86e862394d2fc900592e97b83c04cc35e3c8443108114b7f1dfba",
        "recorded_at": "2026-08-28",
        "artefact_role": "reviewed-primary-source",
        "access_basis": "public-primary",
        "evidence_ref": "https://www.imda.gov.sg/-/media/imda/files/about/emerging-tech-and-research/artificial-intelligence/mgf-for-agentic-ai.pdf"
      },
      "assurance_provenance": []
    },
    {
      "vigil_source_id": "EXT-2B2B0FF7FBE9",
      "external_source_id": "NIST-AI-100-2",
      "source_version": "E2025",
      "source_metadata_fingerprint": "69fa03746e3247bd27d1b598f53a9c5e604f0befe598f290f6bf2ceba71b8284",
      "reviewed_source_digest": {
        "algorithm": "sha256",
        "digest": "4811fb6ad73f9c9121843ab77e029b5adc6f2c86d33c2fc5b2099ef133847646",
        "recorded_at": "2026-08-28",
        "artefact_role": "reviewed-primary-source",
        "access_basis": "public-primary",
        "evidence_ref": "https://doi.org/10.6028/NIST.AI.100-2e2025"
      },
      "assurance_provenance": []
    },
    {
      "vigil_source_id": "EXT-5BC2AAEAF1D3",
      "external_source_id": "NIST-AI-100-4",
      "source_version": "2024",
      "source_metadata_fingerprint": "ef2c6bc4e7669ff7e762d30fec5461f06d445fa3f561aba4bf23afe88b056bf2",
      "reviewed_source_digest": {
        "algorithm": "sha256",
        "digest": "a387a4977db70d65cdbc178c8b0cb8aa5dedb85fa80d6f473c244e2767a4fd54",
        "recorded_at": "2026-08-29",
        "artefact_role": "reviewed-primary-source",
        "access_basis": "public-primary",
        "evidence_ref": "https://doi.org/10.6028/NIST.AI.100-4"
      },
      "assurance_provenance": []
    },
    {
      "vigil_source_id": "EXT-DE4FDB52698E",
      "external_source_id": "NIST-AI-600-1",
      "source_version": "2024",
      "source_metadata_fingerprint": "9484a72197e7cdcd01667b95f07c33dded8eaec7923b1a57386621dca9b2c742",
      "reviewed_source_digest": {
        "algorithm": "sha256",
        "digest": "6e73620ab6b64e90ef2c04bf0e0d6246185a2f4b1b13cab0df494496cff89b6a",
        "recorded_at": "2026-08-28",
        "artefact_role": "reviewed-primary-source",
        "access_basis": "public-primary",
        "evidence_ref": "https://nvlpubs.nist.gov/nistpubs/ai/NIST.AI.600-1.pdf"
      },
      "assurance_provenance": []
    },
    {
      "vigil_source_id": "EXT-1BE47AB84994",
      "external_source_id": "NIST-SP-1270",
      "source_version": "2022",
      "source_metadata_fingerprint": "148c48bd83103cd1057b688b0104ef130f93e96ec9a67ceaaa1e82b18e98f164",
      "reviewed_source_digest": {
        "algorithm": "sha256",
        "digest": "334042ba11ed24d7446cc31967e6e1eb4921f50a17eec4eb14ef1bff078f1e09",
        "recorded_at": "2026-08-29",
        "artefact_role": "reviewed-primary-source",
        "access_basis": "public-primary",
        "evidence_ref": "https://doi.org/10.6028/NIST.SP.1270"
      },
      "assurance_provenance": []
    },
    {
      "vigil_source_id": "EXT-65F7658B8B04",
      "external_source_id": "NIST-SP-800-218A",
      "source_version": "2024",
      "source_metadata_fingerprint": "7e8c131e26a2cfe8630126797044694a87c22282b14920198f92ec8a19fae1bc",
      "reviewed_source_digest": {
        "algorithm": "sha256",
        "digest": "e088c8bc75716824dae7c36a987f408364638561d381ed001b5c12254a7b10d8",
        "recorded_at": "2026-08-28",
        "artefact_role": "reviewed-primary-source",
        "access_basis": "public-primary",
        "evidence_ref": "https://nvlpubs.nist.gov/nistpubs/SpecialPublications/NIST.SP.800-218A.pdf"
      },
      "assurance_provenance": []
    },
    {
      "vigil_source_id": "EXT-71B4139453FA",
      "external_source_id": "SPDX-SPEC",
      "source_version": "3.0.1",
      "source_metadata_fingerprint": "43764801bf0053f75f9cb30bb8e624eb00f359e2d879b52450d2b091dc669343",
      "reviewed_source_digest": {
        "algorithm": "sha256",
        "digest": "a581d62e18bab652752ee3d0e5508cf46fbc20361cc99ba539fafb781daa6197",
        "recorded_at": "2026-08-30",
        "artefact_role": "reviewed-primary-source",
        "access_basis": "public-primary",
        "evidence_ref": "https://github.com/spdx/spdx-3-model/tree/3.0.1/model/AI"
      },
      "assurance_provenance": []
    },
    {
      "vigil_source_id": "EXT-8D54F96680C4",
      "external_source_id": "IEEE-7014",
      "source_version": "2024",
      "source_metadata_fingerprint": "25c22e8e007b7acbe5cd0111c5828088f0b005dc2c671f0e2f5882afcc2865ab",
      "reviewed_source_digest": {
        "algorithm": "sha256",
        "digest": "237d4d782aabf0585170e0eef8d0f313fc353b8f90cd4f94a2db0d993c45c43b",
        "recorded_at": "2026-09-03",
        "artefact_role": "reviewed-primary-source",
        "access_basis": "licensed-primary",
        "evidence_ref": "https://standards.ieee.org/ieee/7014/7648/"
      },
      "assurance_provenance": []
    },
    {
      "vigil_source_id": "EXT-338E4D8BD259",
      "external_source_id": "IEEE-7001",
      "source_version": "2021",
      "source_metadata_fingerprint": "9a7c443a8adc44faf2654c5386e2034ebe871fc56e8d72845911e641abaae707",
      "reviewed_source_digest": {
        "algorithm": "sha256",
        "digest": "2bf1a21360236fffa7d87a71d544cd47153dae2bbcdf7e48dffe19bda289006b",
        "recorded_at": "2026-09-04",
        "artefact_role": "reviewed-primary-source",
        "access_basis": "licensed-primary",
        "evidence_ref": "https://standards.ieee.org/ieee/7001/6929/"
      },
      "assurance_provenance": []
    },
    {
      "vigil_source_id": "EXT-8E377EF5CE66",
      "external_source_id": "IEEE-7010",
      "source_version": "2020",
      "source_metadata_fingerprint": "494807a3421138e12d35fed28071f2f856a9b408b693a876564042f280768bde",
      "reviewed_source_digest": {
        "algorithm": "sha256",